category,title,issuer_or_event,date,description,image,link,tags,priority
Hackathons,GFG VIT-AP Hacktoberfest 2023,GFG VIT-AP Student Chapter,Oct 2023,"Certificate of participation for GFG VIT-AP Hacktoberfest 2023, organized by the GFG VIT-AP Student Chapter.",credentials/gfgvitap-hacktoberfest-2023.jpg,#contact,Hackathon|GFG|Open Source,1
Hackathons,Sixth Sense Event,Innovators Club VIT-AP,,"Participation certificate from the Sixth Sense event conducted by Innovators Club at VIT-AP.",credentials/sixth-sense-innovators-club.jpg,#contact,Hackathon|Innovation|Event,2
Certification,Basics of Arduino Programming,VIT-AP University,2022,"Certificate of completion for a 30-hour value-added course on Basics of Arduino Programming organized by the Department of Computer Science and Engineering.",credentials/basics-of-arduino-programming.jpg,#contact,Certification|Arduino|Embedded Systems,3
Certification,Artificial Intelligence and Its Applications,VIT-AP University,,"Certificate of participation for a one-day national seminar on Artificial Intelligence and Its Applications.",credentials/ai-applications-seminar.jpg,#contact,Certification|AI|Seminar,4
Research,Remote Sensing and Climate Data,NRSC / ISRO research work,,"Research work connects atmospheric CO2, satellite datasets, land-use behavior, climate zones, regression modeling, and explainable analysis.",research/research_paper_.jpg,#contact,Research|Climate Data,5
